"ACHIEVERS I started my work at NASA at the Langley Research Centre (LRC) in Hampton, Virginia."
"This is primarily an R&D centre for advanced aerospace technology. One of my most vivid memories"
"of LRC is of a piece of sculpture depicting a charioteer driving two horses, one representing scientific"
"research and the other technological development, metaphorically encapsulating the"
"interconnection between research and development. From LRC I went to the Goddard Space Flight"
"Centre (GSFC) at Greenbelt, Maryland. This Centre develops and manages most of NASA’s earth-"
"orbiting science and applications satellites. It operates NASA’s tracking networks for all space"
"missions. Towards the end of my visit, Iwent to the Wallops Flight Facility at Wallops Island in East"
"Coast, Virginia. This place was the base for NASA’s sounding rocket programme. Here, I saw a"
"painting prominently displayed in the reception lobby. It depicted a battle scene with a few rockets"
"flying in the background. A painting with this theme should be the most commonplace thing at a"
"Flight Facility, but the painting caught my eye because the soldiers on the side launching the rockets"
"were not white, but dark-skinned, with the racial features of people found in South Asia. One day,"
"my curiosity got the better of me, drawing me towards the painting. It turned out to be Tipu Sultan’s"
"army fighting the British. The painting depicted a fact forgotten in Tipu’s own country but"
"commemorated here on the other side of the planet. I was happy to see an Indian glorified by NASA"
"as a hero of warfare rocketry. My impression of the American people can be summarized by a"
"quotation from Benjamin Franklin, “Those things that hurt instruct!” I realised that people in this"
"part of the world meet their problems head on. They attempt to get out of them rather than suffer"
"them. My mother had once narrated an incident from the Holy Book— after God created man, he"
"asked the angels to prostrate themselves before Adam. Everybody prostrated themselves except"
"Iblis, or Satan, who refused. “Why did you not prostrate yourself?” Allah asked. “You created me of"
"fire and him of clay. Does not that make me nobler than Adam?” Satan contended. God said, “Be"
"gone from paradise! This is no place for your contemptuous pride.” Satan obeyed, but not before"
"cursing Adam with the same fate. Soon Adam followed suit by becoming a transgressor after eating"
"the forbidden fruit. Allah said, “Go hence and may your descendants live a life of doubt and"
"mistrust.” What makes life in Indian organizations difficult is the widespread prevalence of this very"
"contemptuous pride. It stops us from listening to our juniors, subordinates and people down the"
"line. You cannot expect a person to deliver results if you humiliate him, nor can you expect him to be"
"creative if you abuse him or despise him. The line between firmness and harshness, between strong"
"leadership and bullying, between discipline and vindictiveness is very fine, but it has to be drawn."
"Unfortunately, the only line prominently drawn in our country today is between the ‘heroes’ and the"
"‘zeros’. On one side are a few hundred ‘heroes’ keeping nine hundred and fifty million people down"
"on the other side. This situation has to be changed. As the process of confronting and solving"
"problems often requires hard work and is painful, we have endless procrastination. Actually,"
"problems can be the cutting edge that actually distinguish between success and failure. They draw"
"out innate courage and wisdom. As soon as I returned from NASA, India’s first rocket launch took"
"place on 21 November 1963. It was a sounding rocket, called NikeApache, made at NASA. The rocket"
"was assembled in the church building I have referred to earlier. The only equipment available to"
"transport the rocket was a truck and a manually operated hydraulic crane. The assembled rocket"
"was to be shifted from the church building to the launch pad by truck. When the rocket was lifted by"
"the crane and was about to be placed on the launcher, it started tilting, indicating a leak in the"
"hydraulic system of the crane. As we were fast approaching the launch time, 6 p.m., any repairs to"
"the crane had to be ruled out. Fortunately, the leak was not large and we managed to lift the rocket"
"manually, using our collective muscle power and finally placing it on the launcher. In the maiden"
"Nike-Apache launch, I was in charge of rocket integration and safety. Two of my colleagues who"
"played a very active and crucial role in this launch were D Easwardas and R Aravamudan. Easwardas"
"undertook the rocket assembly and arranged the launch. Aravamudan, whom we called Dan, was in"
"charge of radar, telemetry and ground support. The launch was smooth and problemfree. We"
"obtained excellent flight data and returned with a sense of pride and accomplishment. When we"
"were relaxing the next evening at the dinner table, we received news of the assassination of"
"President John F Kennedy in Dallas, Texas. We were appalled. The Kennedy years were a significant"
"era in America, when young men were at the helm of affairs. I used to read with interest about"
"Kennedy’s moves in the missile crisis of late 1962. The Soviet Union built missile sites in Cuba, from"
"which it would have been possible to launch attacks on American cities. Kennedy imposed a"
"blockade or ‘quarantine’, barring the introduction of any offensive missiles to Cuba. America also"
"threatened to respond to any Soviet nuclear attack from Cuba on any country in the Western"
"Hemisphere by retaliating against the USSR. After fourteen days of intense drama, the crisis was"
"resolved by the Soviet Premier Khrushchev ordering that the Cuban bases be dismantled and the"
"missiles returned to Russia. The next day, Prof. Sarabhai had a detailed discussion with us on future"
"plans. He was creating a new frontier in the field of science and technology in India. A new"
"generation, scientists and engineers in their 30s and early 40s, was being charged with an"
"unprecedented dynamism. Our biggest qualifications at INCOSPAR were not our degrees and"
"training, but Prof. Sarabhai’s faith in our capabilities. After the successful launch of Nike-Apache, he"
"chose to share with us his dream of an Indian Satellite Launch Vehicle. Prof. Sarabhai’s optimism was"
"highly contagious. The very news of his coming to Thumba would electrify people and all"
"laboratories, workshops and design offices would hum with unceasing activity. People would work"
"virtually round the clock because of their enthusiasm to show Prof. Sarabhai something new,"
"something that had not been done before in our country—be it a new design or a new method of"
"fabrication or even an out-of-the-way administrative procedure. Prof. Sarabhai would often assign"
"multiple tasks to a single person or a group. Though some of those tasks would appear totally"
"unrelated in the beginning, they would, at a later stage, emerge as deeply interconnected. When"
"Prof. Sarabhai was talking to us about the Satellite Launch Vehicle (SLV), he asked me, almost in the"
"same breath, to take up studies on a rocketassisted take-off system (RATO) for military aircraft. The"
"two things had no apparent connection except in the mind of this great visionary. I knew that all I"
"had to do was to remain alert and focussed on my purpose, and sooner or later, an opportunity to"
"do a challenging job would enter my laboratory. Prof. Sarabhai was ever-willing to try out novel"
"approaches and liked to draw in young people. He had the wisdom and judgement which enabled"
"him to realise not only if something was well done, but also when it was time to stop. In my opinion,"
"he was an ideal experimenter and innovator. When there were alternative courses of action before"
"us, whose outcome was difficult to predict, or to reconcile varying perspectives, Prof. Sarabhai"
"would resort to experimentation to resolve the issue. This was precisely the situation at INCOSPAR in"
"1963. A bunch of young, inexperienced, but nevertheless energetic and enthusiastic persons were"
"given the task of fleshing out the spirit of selfreliance in the field of science and technology in"
"general, and of space research in particular. It was a great example of leadership by trust. The rocket"
"launch site later blossomed into the Thumba Equatorial Rocket Launch Station (TERLS). TERLS was"
"established through active collaboration with France, USA and USSR. The leader of the Indian space"
"programme— Prof. Vikram Sarabhai—had comprehended the full implications of the challenge and"
"had not balked at taking it on. Right from the day INCOSPAR was formed, he was aware of the need"
"to organize an integrated national space programme, with the equipment for the manufacture of"
"rockets and launch facilities developed and produced indigenously. With this in view, a wide-ranging"
"programme for scientific and technological development in rocket fuels, propulsion systems,"
"aeronautics, aerospace materials, advanced fabrication techniques, rocket motor instrumentation,"
"control and guidance systems, telemetry, tracking systems and scientific instruments for"
"experimentation in space were launched at the Space Science and Technology Centre and the"
"Physical Research Laboratory at Ahmedabad. Incidentally, this laboratory has produced a large"
"number of Indian space scientists of extremely high calibre over the years. The real journey of the"
"Indian aerospace programme, however, had begun with the Rohini Sounding Rocket (RSR)"
"Programme. What is it that distinguishes a sounding rocket from a Satellite Launch Vehicle (SLV) and"
"from a missile? In fact, they are three different kinds of rockets. Sounding rockets are normally used"
"for probing the near- earth environment, including the upper regions of the atmosphere. While they"
"can carry a variety of scientific payloads to a range of altitudes, they cannot impart the final velocity"
"needed to orbit the payload. On the other hand, a launch vehicle is designed to inject into orbit a"
"technological payload or satellite. The final stage of a launch vehicle provides the necessary velocity"
"for a satellite to enter an orbit. This is a complex operation requiring on- board guidance and control"
"systems. A missile, though belonging to the same family, is a still more complex system. In addition"
"to the large terminal velocity and onboard guidance and control, it must have the capability to home"
"onto targets. When the targets are fast-moving and capable of manoeuvring, a missile is also"
"required to carry out target-tracking functions. The RSR programme was responsible for the"
"development and fabrication of sounding rockets and their associated on-board systems for"
"scientific investigations in India. Under this programme, a family of operational sounding rockets"
"were developed. These rockets had wide ranging capabilities, and to date several hundreds of these"
"rockets have been launched for various scientific and technological studies. I still remember that the"
"first Rohini rocket consisted of a single solid propulsion motor weighing a mere 32 kg. It lifted a"
"nominal 7 kg payload to an altitude of about 10 km. It was soon followed by another, to which one"
"more solid propellant stage was added to dispatch multi-experiment payloads weighing nearly 100"
"kg to an altitude of over 350 km.The development of these rockets had resulted in a fully indigenous"
"capability in the production of sounding rockets as well as their propellants. This programme had"
"brought into the country technology for the production of very high- performance solid propellants,"
"like those based on polyurethane and polybutane polymer. It later resulted in the setting up of a"
"Propellant Fuel Complex (PFC) to manufacture strategic chemicals required for rocket engines, and a"
"Rocket Propellant Plant (RPP) to produce propellants. The development of Indian rockets in the"
"twentieth century can be seen as a revival of the eighteenth century dream of Tipu Sultan. When"
"Tipu Sultan was killed, the British captured more than 700 rockets and subsystems of 900 rockets in"
"the battle of Turukhanahally in 1799. His army had 27 brigades, called Kushoons, and each brigade"
"had a company of rocket men, called Jourks. These rockets had been taken to England by William"
"Congreve and were subjected by the British to what we call ‘reverse engineering’ today. There were,"
"of course, no GATT, IPR Act, or patent regime. With the death of Tipu, Indian rocketry also met its"
"demise—at least for 150 years. Meanwhile, rocket technology made great strides abroad. Konstantin"
"Tsiolkovsky in Russia (1903), Robert Goddard in USA (1914) and Hermann Oberth in Germany (1923)"
"gave rocketry new dimensions. In Nazi Germany, Wernher von Braun’s group produced V-2 short"
"range ballistic missiles and showered fire on the Allied Forces. After the war, both the USA and the"
"USSR captured their share of German rocket technology and rocket engineers. With this booty, they"
"started to run their deadly arms race with missiles and warheads. Rocketry was reborn in India"
"thanks to the technological vision of Prime Minister Jawaharlal Nehru. Prof. Sarabhai took the"
"challenge of giving physical dimensions to this dream. Very many individuals with myopic vision"
"questioned the relevance of space activities in a newly independent nation which was finding it"
"difficult to feed its population. But neither Prime Minister Nehru nor Prof. Sarabhai had any"
"ambiguity of purpose. Their vision was very clear: if Indians were to play a meaningful role in the"
"community of nations, they must be second to none in the application of advanced technologies to"
"their real-life problems. They had no intention of using it merely as a means to display our might. * *"
"* 5 Dreamers D uring his frequent visits to Thumba, Prof. Sarabhai would openly review the progress"
"of work with the entire team. He never gave directions. Rather, through a free exchange of views, he"
"led us forward into new terrain which often revealed an unforeseen solution. Perhaps he was aware"
"that though a particular goal might be clear to himself, and he could give adequate directions for its"
"accomplishment, his team members might have resisted working towards a goal that made no sense"
"to them. He considered the collective understanding of the problem the main attribute of effective"
"leadership. He once told me, “Look, my job is to make decisions; but it is equally important to see to"
"it that these decisions are accepted by my team members.” In fact, Prof. Sarabhai took a series of"
"decisions that were to become the life-mission of many. We would make our own rockets, our own"
"Satellite Launch Vehicles (SLVs) and our own satellites. And this would not be done one-by- one but"
"concurrently, in a multi-dimensional fashion. In the development of payloads for the sounding"
"rockets, instead of getting a certain payload and then engineering it to fit into the rocket, we"
"discussed the matter threadbare with the payload scientists working in different organ-izations and"
"at different locations. I may even say that the most significant achievement of the sounding rocket"
"programme was to establish and maintain nation-wide mutual trust. Perhaps realising that I"
"preferred to persuade people to do as they were told rather than use my legitimate authority, Prof."
"Sarabhai assigned me the task of providing interface support to payload scientists. Almost all"
"physical laboratories in India were involved in the sounding rocket programme, each having its own"
"mission, its own objective and its own payload. These payloads were required to be integrated to"
"the rocket structure so as to ensure their proper functioning and endurance under flight conditions."
"We had X-ray payloads to look at stars; payloads fitted with radio frequency mass spectrometers to"
"analyse the gas composition of the upper atmosphere; sodium payloads to find out wind conditions,"
"its direction and velocity. We also had ionospheric payloads to explore different layers of the"
"atmosphere. I not only had to interact with scientists from TIFR, National Physical Laboratory (NPL),"
"and Physical Research Laboratory (PRL), but also with payload scientists from USA, USSR, France,"
"Germany and Japan. I often read Khalil Gibran, and always find his words full of wisdom. “Bread"
"baked without love is a bitter bread that feeds but half a man’s hunger,”—those who cannot work"
"with their hearts achieve but a hollow, half-hearted success that breeds bitterness all around. If you"
"are a writer who would secretly prefer to be a lawyer or a doctor, your written words will feed but"
"half the hunger of your readers; if you are a teacher who would rather be a businessman, your"
"instructions will meet but half the need for knowledge of your students; if you are a scientist who"
"hates science, your performance will satisfy but half the needs of your mission. The personal"
"unhappiness and failure to achieve results that comes from being a round peg in a square hole is"
"not, by any means, new. But there are exceptions to this like Prof. Oda and Sudhakar, who bring to"
"their work a personal touch of magic based upon their individual character, personality, inner"
"motives, and perhaps the dreams crystallized within their hearts. They become so emotionally"
"involved with their work that any dilution of the success of their effort fills them with grief. Prof. Oda"
"was an X-ray payload scientist from the Institute of Space and Aeronautical Sciences (ISAS), Japan."
"Iremember him as a diminutive man with a towering personality and eyes that radiated intelligence."
"His dedication to his work was exemplary. He would bring Xray payloads from ISAS, which along with"
"the X-ray payloads made by Prof. UR Rao, would be engineered by my team to fit into the nose cone"
"of the Rohini Rocket. At an altitude of 150 km, the nose cone would be separated by explosion of"
"pyros triggered by an electronic timer. With this, the X-ray sensors would be exposed to space for"
"collecting the required information about the emissions from stars. Together, Prof. Oda and Prof."
"Rao were a unique blend of intellect and dedication, which one rarely sees. One day, when I was"
"working on the integration for Prof. Oda’s payload with my timer devices, he insisted on using the"
"timers he had brought from Japan. To me they looked flimsy, but Prof. Oda stuck to his stand that"
"the Indian timers be replaced by the Japanese ones. I yielded to his suggestion and replaced the"
"timers. The rocket took off elegantly and attained the intended altitude. But the telemetry signal"
"reported mission failure on account of timer malfunction. Prof. Oda was so upset that tears welled"
"up in his eyes. I was stunned by the emotional intensity of Prof. Oda’s response. He had clearly put"
"his heart and soul into his work. Sudhakar was my colleague in the Payload Preparation Laboratory."
"As part of the pre-launch schedule, we were filling and remotely pressing the hazardous sodium and"
"thermite mix. As usual, it was a hot and humid day at Thumba. After the sixth such operation,"
"Sudhakar and I went into the payload room to confirm the proper filling of the mix. Suddenly, a drop"
"of sweat from his forehead fell onto the sodium, and before we knew what was happening, there"
"was a violent explosion which shook the room. For a few paralysed seconds, I did not know what to"
"do. The fire was spreading, and water would not extinguish the sodium fire. Trapped in this inferno,"
"Sudhakar, however, did not lose his presence of mind. He broke the glass window with his bare"
"hands and literally threw me out to safety before jumping out himself. I touched Sudhakar’s bleeding"
"hands in gratitude, he was smiling through his pain. Sudhakar spent many weeks in the hospital"
"recuperating from the severe burns he had received. At TERLS, I was involved with rocket"
"preparation activities, payload assembly, testing and evaluation besides building subsystems like"
"payload housing and jettisonable nose cones. Working with the nose cones led me, as a natural"
"consequence, into the field of composite materials. It is interesting to know that the bows found,"
"during archaeological excavations at different sites in the country, reveal that Indians used"
"composite bows made of wood, sinew, and horn as early as the eleventh century, at least 500 years"
"before such bows were made in medieval Europe. The versatility of composites, in the sense that"
"they possess very desirable structural, thermal, electrical, chemical and mechanical properties,"
"fascinated me. I was so enthused with these man-made materials that I was in a hurry to know"
"everything about them almost overnight. I used to read up everything available on related topics. I"
"was particularly interested in the glass and carbon Fibre Reinforced Plastic (FRP) composites. An FRP"
"composite is composed of an inorganic fibre woven into a matrix that encloses it and gives the"
"component its bulk form. In February 1969, Prime Minister Indira Gandhi visited Thumba to dedicate"
"TERLS to the International Space Science Community. On this occasion, she commissioned the"
"country’s first filament winding machine in our laboratory. This event brought my team, which"
"included CR Satya, PN Subramanian and MN Satyanara-yana, great satisfaction. We made"
"highstrength glass cloth laminates to build non-magnetic payload housings and flew them in two-"
"stage sounding rockets. We also wound and test flew rocket motor casings of up to 360 mm"
"diameter. Slowly, but surely, two Indian rockets were born at Thumba. They were christened Rohini"
"and Menaka, after the two mythological dancers in the court of Indra, the king of the sky. The Indian"
"payloads no longer needed to be launched by French rockets. Could this have been done but for the"
"atmosphere of trust and commitment which Prof. Sarabhai had created at INCOSPAR? He brought"
"into use each person’s knowledge and skills. He made every man feel directly involved in problem"
"solving. By the very fact of the team members’ participation, the solutions became genuine and"
"earned the trust of the entire team resulting in total commitment towards implementation. Prof."
"Sarabhai was matter-of-fact and never tried to hide his disappointment. He used to talk with us in an"
"honest and objective manner. Sometimes I found him making things look more positive than they"
"actually were, and then charming us by his almost magical powers of persuasion. When we were at"
"the drawing board, he would bring someone from the developed world for a technical collaboration."
"That was his subtle way of challenging each one of us to stretch our capabilities. At the same time,"
"even if we failed to meet certain objectives, he would praise whatever we had accomplished."
"Whenever he found any one of us going over his head and attempting a task for which he did not"
"have the capability or skill, Prof. Sarabhai would reassign activity in such a way so as to lower"
"pressure and permit better quality work to be performed. By the time the first Rohini-75 rocket was"
"launched from TERLS on 20 November 1967, almost each one of us was in his own groove. Early next"
"year, Prof. Sarabhai wanted to see me urgently in Delhi. By now I was accustomed to Prof. Sarabhai’s"
"working methods. He was always full of enthusiasm and optimism. In such a state of mind, sudden"
"flashes of inspiration were almost natural. On reaching Delhi, I contacted Prof. Sarabhai’s secretary"
"for an appointment and was asked to meet him at 3.30 a.m. at Hotel Ashoka. Delhi being a slightly"
"unfamiliar place, with an unfriendly climate for someone like me, conditioned to the warm and"
"humid climate of South India, I decided to wait in the hotel lounge after finishing my dinner. I have"
"always been a religious person in the sense that I maintain a working partnership with God. I was"
"aware that the best work required more ability than I possessed and therefore I needed help that"
"onlyGod could give me. Imade a true estimate of my own ability, then raised it by 50 per cent and"
"put myself in God’s hands. In this partnership, I have always received all the power I needed, and in"
"fact have actually felt it flowing through me. Today, I can affirm that the kingdom of God is within"
"you in the form of this power, to help achieve your goals and realise your dreams. There are many"
"different types and levels of experience that turn this internal power reaction critical. Sometimes,"
"when we are ready, the gentlest of contacts with Him fills us with insight and wisdom. This could"
"come from an encounter with another person, from a word, a question, a gesture or even a look."
"Many a time, it could come even through a book, a conversation, some phrase, even a line from a"
"poem or the mere sight of a picture. Without the slightest warning, something new breaks into your"
"life and a secret decision is taken, a decision that you may be completely unconscious of, to start"
"with. I looked around the elegant lounge. Somebody had left a book on a nearby sofa. As if to fill the"
"small hours of that cold night with some warm thoughts, I picked up the book and started browsing."
"I must have turned only a few pages of the book, about which I do not remember a thing today. It"
"was some popular book related to business management. Iwas not really reading it, only skimming"
"over paragraphs and turning pages. Suddenly, my eyes fell on a passage in the book, it was a"
